{
  "sprite_size": "8x8",
  "zoomed": false,
  "screen_h": 192,
  "sprites": [
    {"y": 112, "x": 40, "tile": 0},
    {"y": 112, "x": 48, "tile": 1},
    {"y": 112, "x": 56, "tile": 2},
    {"y": 112, "x": 64, "tile": 3},
    {"y": 120, "x": 40, "tile": 4},
    {"y": 120, "x": 48, "tile": 5},
    {"y": 120, "x": 56, "tile": 6},
    {"y": 176, "x": 40, "tile": 7},
    {"y": 112, "x": 176, "tile": 8},
    {"y": 112, "x": 184, "tile": 9},
    {"y": 112, "x": 192, "tile": 10},
    {"y": 112, "x": 200, "tile": 11},
    {"y": 120, "x": 176, "tile": 12},
    {"y": 120, "x": 184, "tile": 13},
    {"y": 120, "x": 192, "tile": 14},
    {"y": 176, "x": 176, "tile": 15}
  ]
}
